"NOME_STRUT","DS_ATS","DS_ASST","COMUNE","PROV","LAT","LONG_","ID_struttura","original","ID_erogatore","check","n","ID_group"
"CASA DI CURA B. L. PALAZZOLO - FONDAZIONE DON CARLO GNOCCHI ONLUS-POLIAMBULATORIO-1-AMBULATORIO PRINCIPALE-1 (IST. PALAZZOLO - POLIAMBULAT.)","ATS DELLA CITTA' METROPOLITANA DI MILANO","ASST SANTI PAOLO E CARLO","MILANO","MI",45.4894283,9.1444404,2897,"IST. PALAZZOLO - POLIAMBULAT.",193,TRUE,1,1
"OSPEDALE ""SANTISSIMA TRINITÀ""-PSICHIATRIA-1-CPS-1 (CPS - DI TREVIGLIO)","ATS DI BERGAMO","ASST DI BERGAMO OVEST","TREVIGLIO","BG",45.5204275,9.5908991,3647,"CPS - DI TREVIGLIO",195,TRUE,1,1
"CRAGIF SRL","ATS DELLA CITTA' METROPOLITANA DI MILANO","ASST RHODENSE","TREZZANO SUL NAVIGLIO","MI",45.4248654,9.0662115,701,"CRAGIF SRL",196,TRUE,1,1
"PRESIDIO OSPEDALIERO DI MELZO-GORGONZOLA (STAB DI MELZO)-POLIAMBULATORIO-1-AMBULATORIO PRINCIPALE-1 (P.O. S.MARIA D.STELLE)","ATS DELLA CITTA' METROPOLITANA DI MILANO","ASST MELEGNANO E DELLA MARTESANA","MELZO","MI",45.50851,9.4281,2829,"P.O. S.MARIA D.STELLE",198,TRUE,1,1
"OSPEDALE DI SALO'  (STAB DEL PO DI GAVARDO)-PSICHIATRIA-1-CPS-2 (CPS LONATO)","ATS DI BRESCIA","ASST DEL GARDA","LONATO DEL GARDA","BS",45.4569502,10.497972,2772,"CPS LONATO",199,TRUE,1,1
"PO ASOLA E BOZZOLO (STAB BOZZOLO)-POLIAMBULATORIO-1-AMBULATORIO PRINCIPALE-1 (POLIAMBULATORIO - BOZZOLO)","ATS DELLA VAL PADANA","ASST DI CREMONA","BOZZOLO","MN",45.1015673,10.4786714,3220,"POLIAMBULATORIO - BOZZOLO",202,TRUE,1,1
"OSPEDALE SACRA FAMIGLIA FATEBENEFRATELLI - ERBA-POLIAMBULATORIO-1-AMBULATORIO PRINCIPALE-1 (OSPED. F.B.F. SACRA FAMIGLIA)","ATS DELL'INSUBRIA","ASST LARIANA","ERBA","CO",45.8167492,9.2256732,3119,"OSPED. F.B.F. SACRA FAMIGLIA",203,TRUE,1,1
"PRESIDIO DI VARESE (OSP DI CIRCOLO VARESE)-PSICHIATRIA-2-AMBULATORIO PRINCIPALE-1 (C.P.S. ARCISATE)","ATS DELL'INSUBRIA","ASST DEI SETTE LAGHI","ARCISATE","VA",45.85927,8.85711,2905,"C.P.S. ARCISATE",205,TRUE,1,1
"OSPEDALE LUIGI SACCO-POLIAMBULATORIO-1-AMBULATORIO PRINCIPALE-1 (OSPEDALE L. SACCO - MILANO)","ATS DELLA CITTA' METROPOLITANA DI MILANO","ASST FATEBENEFRATELLI SACCO","MILANO","MI",45.5175295,9.1201895,3626,"OSPEDALE L. SACCO - MILANO",207,TRUE,1,1
"OSPEDALE DI MANERBIO (UNICO PO CON STAB LENO)-POLIAMBULATORIO-1-AMBULATORIO PRINCIPALE-1 (AMBULATORIO OSP. DI MANERBIO)","ATS DI BRESCIA","ASST DEL GARDA","MANERBIO","BS",45.3568828,10.1433666,2766,"AMBULATORIO OSP. DI MANERBIO",209,TRUE,1,1
"PRESIDIO OSPEDALIERO ""PESENTI-FENAROLI"" - ALZANO LOMBARDO-PSICHIATRIA-1-CPS-3 (C.P.S. - TRESCORE B.)","ATS DI BERGAMO","ASST DI BERGAMO EST","TRESCORE BALNEARIO","BG",45.6947798,9.8481292,7608,"C.P.S. - TRESCORE B.",210,TRUE,1,1
"PRESIDIO OSPEDALIERO ""M.O.A. LOCATELLI"" - PIARIO-POLIAMBULATORIO-1-AMBULATORIO PRINCIPALE-1 (POLIAMB. M.O.A. LOCATELLI)","ATS DI BERGAMO","ASST DI BERGAMO EST","PIARIO","BG",45.88469,9.91527999,3649,"POLIAMB. M.O.A. LOCATELLI",211,TRUE,1,1
"STABILIMENTO OSPEDALIERO DI LEGNANO-POLIAMBULATORIO-1-AMBULATORIO PRINCIPALE-1 (OSPED. S.S.BENEDETTO GELTRUDE)","ATS DELLA CITTA' METROPOLITANA DI MILANO","ASST OVEST MILANESE","CUGGIONO","MI",45.5097615,8.821516,2526,"OSPED. S.S.BENEDETTO GELTRUDE",213,TRUE,1,1
"PRESIDIO OSPEDALIERO DI CREMONA-POLIAMBULATORIO-1 (POLIAMBULATORIO SPECIALISTICO CON PUNTO PRELIEVI)","ATS DELLA VAL PADANA","ASST DI CREMONA","CREMONA","CR",45.14111,10.02329,177,"POLIAMBULATORIO SPECIALISTICO CON PUNTO PRELIEVI",215,TRUE,1,1
"OSPEDALE ERBA - RENALDI DI MENAGGIO-POLIAMBULATORIO-1-AMBULATORIO PRINCIPALE-1 (POLIAMBULATORIO OSP.MENAGGIO)","ATS DELL'INSUBRIA","ASST LARIANA","MENAGGIO","CO",46.0185038,9.2256073,3196,"POLIAMBULATORIO OSP.MENAGGIO",217,TRUE,1,1
"ISTITUTO CLINICO BEATO MATTEO-POLIAMBULATORIO-1-AMBULATORIO PRINCIPALE-1 (IST. CLIN. DI PAVIA E VIGEVANO SPA- IST. CL. BEATO MATTEO-POLIAM.)","ATS DI PAVIA","ASST DI PAVIA","VIGEVANO","PV",45.30701,8.86925,3415,"IST. CLIN. DI PAVIA E VIGEVANO SPA- IST. CL. BEATO MATTEO-POLIAM.",219,TRUE,1,1
"MEDICENTER","ATS DELLA VAL PADANA","ASST DI MANTOVA","MANTOVA","MN",45.15043,10.75319,994,"MEDICENTER",224,TRUE,1,1
"NUOVO OSPEDALE DI VIMERCATE-PSICHIATRIA-1-CPS-3 (CPS DI SEREGNO)","ATS DELLA BRIANZA","ASST DELLA BRIANZA","SEREGNO","MB",45.6454377,9.2123333,3494,"CPS DI SEREGNO",225,TRUE,1,1
"POLIAMBULATORIO VIA PUECHER","ATS DELLA CITTA' METROPOLITANA DI MILANO","ASST FATEBENEFRATELLI SACCO","MILANO","MI",45.5033184,9.2231798,94,"POLIAMBULATORIO VIA PUECHER",226,TRUE,1,1
"STRUTTURA SANITARIA DI TIRANO","ATS DELLA MONTAGNA","ASST DELLA VALTELLINA E DELL'ALTO LARIO","TIRANO","SO",46.2177134,10.1683316,953,"STRUTTURA SANITARIA DI TIRANO",230,TRUE,1,1
"PRESIDIO SANT'ANNA-POLIAMBULATORIO-2-AMBULATORIO PRINCIPALE-1 (POLIAMBULATORIO VIA NAPOLEONA COMO)","ATS DELL'INSUBRIA","ASST LARIANA","COMO","CO",45.79022,9.09,3054,"POLIAMBULATORIO VIA NAPOLEONA COMO",232,TRUE,1,1
"POLIAMBULATORIO DI VIA GIUSSANI 9 - NOVA MILANESE-POLIAMBULATORIO-3-AMBULATORIO PRINCIPALE-1 (AMBULATORIO EXSTRAOSP. NOVA M.SE)","ATS DELLA BRIANZA","ASST DELLA BRIANZA","NOVA MILANESE","MB",45.5886029,9.2009211,3355,"AMBULATORIO EXSTRAOSP. NOVA M.SE",234,TRUE,1,1
"PRESIDIO OSPEDALIERO DI CREMONA-PSICHIATRIA-1-CPS-1 (CPS CREMONA)","ATS DELLA VAL PADANA","ASST DI CREMONA","CREMONA","CR",45.14106,10.0179,2989,"CPS CREMONA",235,TRUE,1,1
"STATIC CENTRO CHIROTERAPEUTICO DI BRESCIA SRL","ATS DI BRESCIA","ASST DEGLI SPEDALI CIVILI DI BRESCIA","BRESCIA","BS",45.52341,10.20917,736,"STATIC CENTRO CHIROTERAPEUTICO DI BRESCIA",238,TRUE,1,1
"ISTITUTO CLINICO VILLA APRICA S.P.A.-POLIAMBULATORIO-1-AMBULATORIO PRINCIPALE-1 (POLIAMBULATORIO ISTITUTO CLINICO VILLA APRICA)","ATS DELL'INSUBRIA","ASST LARIANA","COMO","CO",45.82341,9.06081,3126,"POLIAMBULATORIO ISTITUTO CLINICO VILLA APRICA",239,TRUE,1,1
"GEMINI RX","ATS DI BRESCIA","ASST DEGLI SPEDALI CIVILI DI BRESCIA","TRAVAGLIATO","BS",45.5294681,10.0791731,8159,"GEMINI RX",241,TRUE,1,1
"CLINICA DIAGNOSTICA DOTT. LORENZO TREZZA-POLIAMBULATORIO-1-AMBULATORIO PRINCIPALE-1 (FISIOCENTER C.S.M.D.)","ATS DELLA BRIANZA","ASST DELLA BRIANZA","CARNATE","MB",45.6520371,9.3716978,3185,"FISIOCENTER C.S.M.D.",243,TRUE,1,1
"PRESIDIO UNICO MAGENTA - ABBIATEGRASSO (STAB DI ABBIATEGRASSO)-EMODIALISI-1-CAL-1 (C.A.L. ABBIATEGRASSO)","ATS DELLA CITTA' METROPOLITANA DI MILANO","ASST OVEST MILANESE","ABBIATEGRASSO","MI",45.395124,8.9143274,2521,"C.A.L. ABBIATEGRASSO",248,TRUE,1,1
"OSPEDALE SAN GIUSEPPE-POLIAMBULATORIO-1-AMBULATORIO PRINCIPALE-1 (OSPEDALE S.GIUSEPPE)","ATS DELLA CITTA' METROPOLITANA DI MILANO","ASST FATEBENEFRATELLI SACCO","MILANO","MI",45.4630007,9.1718003,3106,"OSPEDALE S.GIUSEPPE",249,TRUE,1,1
"POLIAMBULATORIO VIA FANTOLI 7","ATS DELLA CITTA' METROPOLITANA DI MILANO","ASST FATEBENEFRATELLI SACCO","MILANO","MI",45.4517026,9.2517058,1036,"POLIAMBULATORIO VIA FANTOLI",251,TRUE,1,1
"OSPEDALE - GALLARATE-POLIAMBULATORIO-1-AMBULATORIO PRINCIPALE-1 (OSPEDALIERO S. ANTONIO ABATE)","ATS DELL'INSUBRIA","ASST DELLA VALLE OLONA","GALLARATE","VA",45.65715,8.79298,3048,"OSPEDALIERO S. ANTONIO ABATE",253,TRUE,1,1
"ISTITUTO CLINICO CITTÀ BRESCIA (STAB DEL PRESIDIO IC S. ANNA)-POLIAMBULATORIO-1-AMBULATORIO PRINCIPALE-1 (IST. CLINICO CITTA' DI BRESCIA)","ATS DI BRESCIA","ASST DEGLI SPEDALI CIVILI DI BRESCIA","BRESCIA","BS",45.5537044,10.2275672,3324,"IST. CLINICO CITTA' DI BRESCIA",255,TRUE,1,1
"PRESIDIO DI VARESE (OSP DI CUASSO AL MONTE)-POLIAMBULATORIO-1-AMBULATORIO PRINCIPALE-1 (POLIAMBULATORIO OSP.CUASSO A/M)","ATS DELL'INSUBRIA","ASST DEI SETTE LAGHI","CUASSO AL MONTE","VA",45.90835,8.85795,2909,"POLIAMBULATORIO OSP.CUASSO A/M",257,TRUE,1,1
"POLIAMBULATORIO DI BREMBATE DI SOPRA","ATS DI BERGAMO","ASST DI BERGAMO OVEST","BREMBATE DI SOPRA","BG",45.72037,9.5844,1087,"POLIAMBULATORIO DI BREMBATE DI SOPRA",258,TRUE,1,1
"PRESIDIO DI VARESE (OSP FILIPPO DEL PONTE)-POLIAMBULATORIO-1-AMBULATORIO PRINCIPALE-1 (POLIAMBULATORIO OSPEDALE F.DEL PONTE-VARESE)","ATS DELL'INSUBRIA","ASST DEI SETTE LAGHI","VARESE","VA",45.81525,8.83427,2902,"POLIAMBULATORIO OSPEDALE F.DEL PONTE-VARESE",259,TRUE,1,1
"POLIAMBULATORIO VIA BARONI","ATS DELLA CITTA' METROPOLITANA DI MILANO","ASST SANTI PAOLO E CARLO","MILANO","MI",45.4122179,9.1714992,1044,"POLIAMBULATORIO VIA BARONI",260,TRUE,1,1
"PRESIDIO OSPEDALIERO ""SS. CAPITANIO E GEROSA"" - LOVERE-POLIAMBULATORIO-1-AMBULATORIO PRINCIPALE-1 (POL. OSP.SS.CAPITANIO E GEROSA)","ATS DI BERGAMO","ASST DI BERGAMO EST","LOVERE","BG",45.81847,10.07483,2534,"POL. OSP.SS.CAPITANIO E GEROSA",261,TRUE,1,1
"OSPEDALE  UMBERTO I°  BELLANO-POLIAMBULATORIO-3-AMBULATORIO PRINCIPALE-1 (POLIAMBULATORIO OSP.DI BELLANO)","ATS DELLA BRIANZA","ASST DI LECCO","BELLANO","LC",46.04513,9.30456,3345,"POLIAMBULATORIO OSP.DI BELLANO",263,TRUE,1,1
"PRESIDIO UNICO MAGENTA - ABBIATEGRASSO (STAB DI MAGENTA)-POLIAMBULATORIO-1-AMBULATORIO PRINCIPALE-1 (OSPED. G.FORNAROLI-MAGENTA)","ATS DELLA CITTA' METROPOLITANA DI MILANO","ASST OVEST MILANESE","MAGENTA","MI",45.4701508,8.8920059,3639,"OSPED. G.FORNAROLI-MAGENTA",264,TRUE,1,1
"PRESIDIO SANT'ANNA-PSICHIATRIA-1-CPS-3 (CPS - CANTU')","ATS DELL'INSUBRIA","ASST LARIANA","CANTU'","CO",45.73554,9.14464,3063,"CPS - CANTU'",265,TRUE,1,1
"OSPEDALE E. BASSINI-POLIAMBULATORIO-1-AMBULATORIO PRINCIPALE-1 (POLIAMBULATORIO OSPEDALE BASSINI)","ATS DELLA CITTA' METROPOLITANA DI MILANO","ASST NORD MILANO","CINISELLO BALSAMO","MI",45.54635,9.21584,2684,"POLIAMBULATORIO OSPEDALE BASSINI",267,TRUE,1,1
"OSPEDALE ARNABOLDI - BRONI-POLIAMBULATORIO-1-AMBULATORIO PRINCIPALE-1 (POLIAMB OSP. BRONI)","ATS DI PAVIA","ASST DI PAVIA","BRONI","PV",45.0690889,9.2675737,3445,"POLIAMB OSP. BRONI",268,TRUE,1,1
"OSPEDALE CIVILE DESTRA SECCHIA-POLIAMBULATORIO-1-AMBULATORIO PRINCIPALE-1 (POLIAMBUL. OSP. BORGO MANTOVANO)","ATS DELLA VAL PADANA","ASST DI MANTOVA","BORGO MANTOVANO","MN",45.03374,11.11883,3002,"POLIAMBUL. OSP. BORGO MANTOVANO",271,TRUE,1,1
"OSPEDALE CIVILE DI VOGHERA-POLIAMBULATORIO-1-AMBULATORIO PRINCIPALE-1 (POLIAMB. OSP. VOGHERA)","ATS DI PAVIA","ASST DI PAVIA","VOGHERA","PV",44.99481,9.01449,3436,"POLIAMB. OSP. VOGHERA",272,TRUE,1,1
"OSPEDALE SS.ANNUNZIATA - VARZI-POLIAMBULATORIO-1-AMBULATORIO PRINCIPALE-1 (POLIAMB. OSP. VARZI)","ATS DI PAVIA","ASST DI PAVIA","VARZI","PV",44.8251008,9.190977,3452,"POLIAMB. OSP. VARZI",276,TRUE,1,1
"PRESIDIO OSPEDALIERO DI GARDONE V.T.-POLIAMBULATORIO-2 (POLIAMBULATORIO DI LUMEZZANE)","ATS DI BRESCIA","ASST DEGLI SPEDALI CIVILI DI BRESCIA","LUMEZZANE","BS",45.64998,10.25996,160,"POLIAMBULATORIO DI LUMEZZANE",278,TRUE,1,1
"KOUROS IMAGING","ATS DELLA CITTA' METROPOLITANA DI MILANO","ASST SANTI PAOLO E CARLO","MILANO","MI",45.4490468,9.1808537,618,"KOUROS IMAGING",279,TRUE,1,1
"IRCCS OSPEDALE SAN RAFFAELE-POLIAMBULATORIO-1-AMBULATORIO PRINCIPALE-1 (ISTITUTO RICOVERO S.RAFFAELE)","ATS DELLA CITTA' METROPOLITANA DI MILANO","ASST FATEBENEFRATELLI SACCO","MILANO","MI",45.5060616,9.267863,2968,"ISTITUTO RICOVERO S.RAFFAELE",283,TRUE,1,1
"SPEDALI CIVILI DI BRESCIA-PSICHIATRIA-1-CPS-1 (1° CPS BRESCIA)","ATS DI BRESCIA","ASST DEGLI SPEDALI CIVILI DI BRESCIA","BRESCIA","BS",45.543372,10.2058095,2536,"1° CPS BRESCIA",285,TRUE,1,1
"PRESIDIO OSPEDALIERO ""PESENTI-FENAROLI"" - ALZANO LOMBARDO-PSICHIATRIA-1-CPS-2 (CPS - PIARIO)","ATS DI BERGAMO","ASST DI BERGAMO EST","PIARIO","BG",45.88469,9.91527999,3657,"CPS - PIARIO",289,TRUE,1,1
"VILLA BIANCA CASA DI CURA-POLIAMBULATORIO-1-AMBULATORIO PRINCIPALE-1 (MULTIMEDICA SPA)","ATS DELLA BRIANZA","ASST DELLA BRIANZA","LIMBIATE","MB",45.6045769,9.1172485,3182,"MULTIMEDICA SPA",291,TRUE,1,1
"POLITERAPICO POLIDIAGNOSTICO (DI VIA BORGAZZI)","ATS DELLA BRIANZA","ASST DI MONZA","MONZA","MB",45.56613,9.26154,817,"POLITERAPICO POLIDIAGNOSTICO",292,TRUE,1,1
"DIAGNOFISIC SRL.","ATS DELLA CITTA' METROPOLITANA DI MILANO","ASST FATEBENEFRATELLI SACCO","MILANO","MI",45.4464164,9.2120756,715,"DIAGNOFISIC",297,TRUE,1,1
"PO DI CERNUSCO SUL NAVIGLIO - VAPRIO D'ADDA (STAB DI VAPRIO D'ADDA)-POLIAMBULATORIO-1-AMBULATORIO PRINCIPALE-1 (OSPEDALE CROTTA OLTROCCHI VAPRIO D'ADDA)","ATS DELLA CITTA' METROPOLITANA DI MILANO","ASST MELEGNANO E DELLA MARTESANA","VAPRIO D'ADDA","MI",45.57358,9.52821,2755,"OSPEDALE CROTTA OLTROCCHI VAPRIO D'ADDA",298,TRUE,1,1
"OSPEDALE ""F. M. PASSI""-POLIAMBULATORIO-1-AMBULATORIO PRINCIPALE-1 (POLIAMBULATORIO OSP.CALCINATE)","ATS DI BERGAMO","ASST DI BERGAMO EST","CALCINATE","BG",45.61973,9.798,3655,"POLIAMBULATORIO OSP.CALCINATE",299,TRUE,1,1
"OSPEDALE S. MARTINO - MEDE-POLIAMBULATORIO-1-AMBULATORIO PRINCIPALE-1 (POLIAMB. OSP. MEDE)","ATS DI PAVIA","ASST DI PAVIA","MEDE","PV",45.0915615,8.7307885,3447,"POLIAMB. OSP. MEDE",300,TRUE,1,1
"OSPEDALE MORIGGIA PELASCINI-POLIAMBULATORIO-1-AMBULATORIO PRINCIPALE-1 (POLIAMBULATORIO OSPEDALE MORIGGIA PELASCINI)","ATS DELLA MONTAGNA","ASST DELLA VALTELLINA E DELL'ALTO LARIO","GRAVEDONA ED UNITI","CO",46.14265,9.29981,3206,"POLIAMBULATORIO OSPEDALE MORIGGIA PELASCINI",301,TRUE,1,1
"AMB. PSICHIATRIA - CASTEL G.","ATS DELLA VAL PADANA","ASST DI MANTOVA","CASTEL GOFFREDO","MN",45.3017712,10.4809021,186,"AMB. PSICHIATRIA - CASTEL G.",302,TRUE,1,1
"NUOVO OSPEDALE DI BRONI STRADELLA-MEDICINA GENERALE-1-CAL-1 (C.A.L. OSPEDALE UNIFICATO DI BRONI-STRADELLA)","ATS DI PAVIA","ASST DI PAVIA","STRADELLA","PV",45.07612,9.28744,2841,"C.A.L. OSPEDALE UNIFICATO DI BRONI-STRADELLA",304,TRUE,1,1
"CENTRO MEDICO DI CASTEL GOFFREDO-RIABILITAZIONE SPECIALISTICA-1-AMBULATORIO PRINCIPALE-1 (POLIAMBULATORI IRCCS CASTEL GOFFREDO)","ATS DELLA VAL PADANA","ASST DI MANTOVA","CASTEL GOFFREDO","MN",45.3015456,10.480844,3401,"POLIAMBULATORI IRCCS CASTEL GOFFREDO",305,TRUE,1,1
"ISTITUTO DI CURA CITTA' DI PAVIA-POLIAMBULATORIO-1-AMBULATORIO PRINCIPALE-1 (ISTITUTI CLINICI DI PAVIA E VIGEVANO S.P.A.-IST DI CURA CITTA' DI PAVIA)","ATS DI PAVIA","ASST DI PAVIA","PAVIA","PV",45.19253,9.16774,3406,"ISTITUTI CLINICI DI PAVIA E VIGEVANO S.P.A.-IST DI CURA CITTA' DI PAVIA",306,TRUE,1,1
"OSPEDALE VALDUCE-POLIAMBULATORIO-1-AMBULATORIO PRINCIPALE-1 (POLIAMB.OSP.GEN.ZONA VALDUCE)","ATS DELL'INSUBRIA","ASST LARIANA","COMO","CO",45.81026,9.08794,3060,"POLIAMB.OSP.GEN.ZONA VALDUCE",307,TRUE,1,1
"ISTITUTO AUXOLOGICO ITALIANO - IRCCS SAN MICHELE (STAB)-POLIAMBULATORIO-1-AMBULATORIO PRINCIPALE-1 (CENTRO AUXOLOGICO IT.S.MICHELE)","ATS DELLA CITTA' METROPOLITANA DI MILANO","ASST SANTI PAOLO E CARLO","MILANO","MI",45.4692652,9.1656562,2955,"CENTRO AUXOLOGICO IT.S.MICHELE",309,TRUE,1,1
"PRESIDIO OSPEDALIERO ""DELMATI"" - S. ANGELO LODIGIANO-POLIAMBULATORIO-1-AMBULATORIO PRINCIPALE-1 (OSP. DELMATI AMBUL. DIAGN.)","ATS DELLA CITTA' METROPOLITANA DI MILANO","ASST DI LODI","SANT'ANGELO LODIGIANO","LO",45.22852,9.41707,2837,"OSP. DELMATI AMBUL. DIAGN.",312,TRUE,1,1
"CENTRO CARDIOLOGICO S.P.A. ""FONDAZIONE MONZINO""-POLIAMBULATORIO-1-AMBULATORIO PRINCIPALE-1 (CENTRO CARDIOLOGICO S.P.A.)","ATS DELLA CITTA' METROPOLITANA DI MILANO","ASST FATEBENEFRATELLI SACCO","MILANO","MI",45.44408,9.26242,2894,"CENTRO CARDIOLOGICO S.P.A.",313,TRUE,1,1
"AMBULATORI P.O. PASSIRANA","ATS DELLA CITTA' METROPOLITANA DI MILANO","ASST RHODENSE","RHO","MI",45.54620397,9.04720576,90,"AMBULATORI P.O. PASSIRANA",318,TRUE,1,1
"OSPEDALE SAN PAOLO-PSICHIATRIA-1-CPS-1 (CPS VIA BARABINO AREA SUD)","ATS DELLA CITTA' METROPOLITANA DI MILANO","ASST FATEBENEFRATELLI SACCO","MILANO","MI",45.4336612,9.2220632,3557,"CPS VIA BARABINO AREA SUD",320,TRUE,1,1
"HABILITA POLIAMBULATORIO CLUSONE","ATS DI BERGAMO","ASST DI BERGAMO EST","CLUSONE","BG",45.8843539,9.954544,876,"HABILITA POLIAMBULATORIO CLUSONE",321,TRUE,1,1
"POLIAMBULATORIO DI ARESE-POLIAMBULATORIO-1-AMBULATORIO PRINCIPALE-1 (POLIAMBULATORIO  ARESE)","ATS DELLA CITTA' METROPOLITANA DI MILANO","ASST RHODENSE","ARESE","MI",45.55148,9.07926,2606,"POLIAMBULATORIO  ARESE",324,TRUE,1,1
"POLIAMBULATORIO CARDINAL SCHUSTER","ATS DELLA CITTA' METROPOLITANA DI MILANO","ASST GRANDE OSPEDALE METROPOLITANO NIGUARDA","MILANO","MI",45.4961058,9.1698682,727,"POLIAMBULATORIO CARDINAL SCHUSTER",326,TRUE,1,1
"S. RAFFAELE TURRO-POLIAMBULATORIO-1-AMBULATORIO PRINCIPALE-1 (SAN RAFFAELE TURRO)","ATS DELLA CITTA' METROPOLITANA DI MILANO","ASST FATEBENEFRATELLI SACCO","MILANO","MI",45.4991899,9.2291095,3033,"SAN RAFFAELE TURRO",328,TRUE,1,1
"SMART CLINIC ORIO CENTER","ATS DI BERGAMO","ASST PAPA GIOVANNI XXIII","ORIO AL SERIO","BG",45.6651,9.69513,1553,"SMART CLINIC ORIO CENTER",331,TRUE,1,1
"POLIAMBULATORIO VIA MASANIELLO","ATS DELLA CITTA' METROPOLITANA DI MILANO","ASST SANTI PAOLO E CARLO","MILANO","MI",45.4628394,9.0908915,8199,"POLIAMBULATORIO VIA MASANIELLO",333,TRUE,1,1
"CENTRO DIAGNOSTICO TREVIGLIO","ATS DI BERGAMO","ASST DI BERGAMO OVEST","TREVIGLIO","BG",45.524863,9.588611,864,"CENTRO DIAGNOSTICO TREVIGLIO",335,TRUE,1,1
"CASA DI CURA VILLA SAN BENEDETTO-POLIAMBULATORIO-1-AMBULATORIO PRINCIPALE-1 (POLIAMBULATORIO VILLA SAN BENEDETTO)","ATS DELL'INSUBRIA","ASST LARIANA","ALBESE CON CASSANO","CO",45.79717,9.16198,3120,"POLIAMBULATORIO VILLA SAN BENEDETTO",337,TRUE,1,1
"POLIAMBULATORIO DI VIA GIUSSANI 9 - NOVA MILANESE-POLIAMBULATORIO-2-AMBULATORIO PRINCIPALE-1 (AMBULATORIO EXTRAOSPED. MUGGIO')","ATS DELLA BRIANZA","ASST DELLA BRIANZA","MUGGIO'","MB",45.588278,9.22483899,3417,"AMBULATORIO EXTRAOSPED. MUGGIO'",339,TRUE,1,1
"I.R.C.C.S. CENTRO SAN GIOVANNI DI DIO FATEBENEFRATELLI-POLIAMBULATORIO-1-AMBULATORIO PRINCIPALE-1 (POLIAMBULATORI IRCCS CENTRO SAN GIOVANNI DI DIO)","ATS DI BRESCIA","ASST DEGLI SPEDALI CIVILI DI BRESCIA","BRESCIA","BS",45.5239142,10.2021241,3326,"POLIAMBULATORI IRCCS CENTRO SAN GIOVANNI DI DIO",341,TRUE,1,1
"PRESIDIO DI VARESE (OSP DI CIRCOLO VARESE)-NEFROLOGIA-1-CAL-1 (C.A.L. - VIA ROSSI)","ATS DELL'INSUBRIA","ASST DEI SETTE LAGHI","VARESE","VA",45.808,8.83731,2903,"C.A.L. - VIA ROSSI",343,TRUE,1,1
"PO DI PALAZZOLO S/O (STAB DEL PO DI ISEO)-POLIAMBULATORIO-1-AMBULATORIO PRINCIPALE-1 (POLIAMBULATORIO PALAZZOLO S/O)","ATS DI BRESCIA","ASST DELLA FRANCIACORTA","PALAZZOLO SULL'OGLIO","BS",45.59989,9.88744,2697,"POLIAMBULATORIO PALAZZOLO S/O",344,TRUE,1,1
"CENTRO MEDICO DI LUMEZZANE-POLIAMBULATORIO-1-AMBULATORIO PRINCIPALE-1 (POLIAMBULATORIO IRCCS LUMEZZANE)","ATS DI BRESCIA","ASST DEGLI SPEDALI CIVILI DI BRESCIA","LUMEZZANE","BS",45.65203,10.25165,3325,"POLIAMBULATORIO IRCCS LUMEZZANE",345,TRUE,1,1
"STUDIO DENTISTICO DOTT. EZIO FRENI SRL","ATS DELL'INSUBRIA","ASST LARIANA","ORSENIGO","CO",45.7761823,9.1731945,917,"STUDIO DENTISTICO DOTT. EZIO FRENI SRL",347,TRUE,1,1
"CENTRO MEDICO DENTAL DUE SAS DI DANILO BETTINI & C.","ATS DELLA CITTA' METROPOLITANA DI MILANO","ASST OVEST MILANESE","LEGNANO","MI",45.5911,8.92047,706,"CENTRO MEDICO DENTAL DUE SAS",350,TRUE,1,1
"OSPEDALE CARLO MIRA - CASORATE PRIMO-PSICHIATRIA-1-CPS-1 (C.P.S. PAVIA)","ATS DI PAVIA","ASST DI PAVIA","PAVIA","PV",45.18828,9.16287,7696,"C.P.S. PAVIA",352,TRUE,1,1
"FONDAZIONE EUROPEA DI RICERCA BIOMEDICA FERB- ONLUS-RIABILITAZIONE SPECIALISTICA-1-AMBULATORIO PRINCIPALE-1 (FONDAZIONE EUROPEA DI RICERCA BIOMEDICA FERB ONLUS)","ATS DELLA CITTA' METROPOLITANA DI MILANO","ASST MELEGNANO E DELLA MARTESANA","CERNUSCO SUL NAVIGLIO","MI",45.5232354,9.3285918,3113,"FONDAZIONE EUROPEA DI RICERCA BIOMEDICA FERB ONLUS",353,TRUE,1,1
"OSPEDALE SS.ANNUNZIATA - VARZI-MEDICINA GENERALE-1-CAL-1 (C.A.L. OSPEDALE VARZI)","ATS DI PAVIA","ASST DI PAVIA","VARZI","PV",44.8251008,9.190977,3449,"C.A.L. OSPEDALE VARZI",354,TRUE,1,1
"CASA DI CURA PRIVATA DEL POLICLINICO S.P.A.-POLIAMBULATORIO-1-AMBULATORIO PRINCIPALE-1 (CASA DI CURA DEL POLICLINICO - AMBULATORIO)","ATS DELLA CITTA' METROPOLITANA DI MILANO","ASST SANTI PAOLO E CARLO","MILANO","MI",45.4595,9.16183,3107,"CASA DI CURA DEL POLICLINICO - AMBULATORIO",356,TRUE,1,1
"OSPEDALE - ANGERA-POLIAMBULATORIO-1-AMBULATORIO PRINCIPALE-1 (POLIAMBULATORIO OSPEDALE CARLO ONDOLI - ANGERA)","ATS DELL'INSUBRIA","ASST DEI SETTE LAGHI","ANGERA","VA",45.7753572,8.5780536,2984,"POLIAMBULATORIO OSPEDALE CARLO ONDOLI - ANGERA",357,TRUE,1,1
"NUOVO OSPEDALE DI BRONI STRADELLA-POLIAMBULATORIO-1-AMBULATORIO PRINCIPALE-1 (POLIAMBULATORIO OSPEDALE UNIFICATO DI BRONI-STRADELLA)","ATS DI PAVIA","ASST DI PAVIA","STRADELLA","PV",45.07612,9.28744,3448,"POLIAMBULATORIO OSPEDALE UNIFICATO DI BRONI-STRADELLA",358,TRUE,1,1
"OSPEDALE VALDUCE-POLIAMBULATORIO-1-AMBULATORIO PRINCIPALE-1 (PRESIDIO DI RIAB.VILLA BERETTA)","ATS DELLA BRIANZA","ASST DI LECCO","COSTA MASNAGA","LC",45.770931,9.27027696,8167,"PRESIDIO DI RIAB.VILLA BERETTA",359,TRUE,1,1
"PRESIDIO POLIAMBULATORIALE PARABIAGO","ATS DELLA CITTA' METROPOLITANA DI MILANO","ASST OVEST MILANESE","PARABIAGO","MI",45.5585007,8.9408545,1032,"POLIAMBULATORIALE PARABIAGO",360,TRUE,1,1
"OSPEDALE CIVILE DI VOGHERA-PSICHIATRIA-1-CPS-1 (C.P.S. VOGHERA - VARZI)","ATS DI PAVIA","ASST DI PAVIA","VOGHERA","PV",44.99481,9.01449,3439,"C.P.S. VOGHERA - VARZI",361,TRUE,1,1
"AMBULATORIO PSICHIATRICO MARIANO COMENSE","ATS DELL'INSUBRIA","ASST LARIANA","MARIANO COMENSE","CO",45.6911185,9.1844108,30,"AMBULATORIO PSICHIATRICO MARIANO COMENSE",362,TRUE,1,1
"OSPEDALE CIVILE LA MEMORIA DI GAVARDO (UNICO PO CON STAB SALÒ)-POLIAMBULATORIO-1-AMBULATORIO PRINCIPALE-1 (POLIAMBULATORI GAVARDO)","ATS DI BRESCIA","ASST DEL GARDA","GAVARDO","BS",45.5886006,10.4390323,2765,"POLIAMBULATORI GAVARDO",363,TRUE,1,1
"CENTRO DIAGNOSTICO GALLARATESE","ATS DELL'INSUBRIA","ASST DELLA VALLE OLONA","GALLARATE","VA",45.65785,8.78584,788,"CENTRO DIAGNOSTICO GALLARATESE",366,TRUE,1,1
"PRESIDIO OSPEDALIERO DI GARDONE V.T.-POLIAMBULATORIO-1-AMBULATORIO PRINCIPALE-1 (CPS 1 - AMBULATORIO GARDONE V/T)","ATS DI BRESCIA","ASST DEGLI SPEDALI CIVILI DI BRESCIA","GARDONE VAL TROMPIA","BS",45.6765932,10.1838145,2619,"AMBULATORIO GARDONE V.T.",369,TRUE,1,1
"OSPEDALE CIVILE VIGEVANO-PSICHIATRIA-1-CPS-3 (C.P.S. VIGEVANO)","ATS DI PAVIA","ASST DI PAVIA","VIGEVANO","PV",45.32369,8.86573,3437,"C.P.S. VIGEVANO",370,TRUE,1,1
"POLIAMBULATORIO SPECIALISTICO EXTRA-OSPEDALIERO - PIOLTELLO-POLIAMBULATORIO-1-AMBULATORIO PRINCIPALE-1 (UOP - AMB. PIOLTELLO)","ATS DELLA CITTA' METROPOLITANA DI MILANO","ASST MELEGNANO E DELLA MARTESANA","PIOLTELLO","MI",45.4974838,9.3221192,2759,"UOP - AMB. PIOLTELLO",371,TRUE,1,1
"OSPEDALE CIVILE DESTRA SECCHIA-PSICHIATRIA-1-AMBULATORIO PRINCIPALE-1 (AMB. PSICHIATRIA - SUZZARA)","ATS DELLA VAL PADANA","ASST DI MANTOVA","SUZZARA","MN",44.99493,10.73368,3004,"AMB. PSICHIATRIA - SUZZARA",372,TRUE,1,1
"BERGAMOSPORTSTUDI - BSS","ATS DI BERGAMO","ASST PAPA GIOVANNI XXIII","BERGAMO","BG",45.71463109,9.69466685,867,"BERGAMOSPORTSTUDI - BSS",373,TRUE,1,1
"CENTRO RADIOLOGICO VALTELLINESE","ATS DELLA MONTAGNA","ASST DELLA VALTELLINA E DELL'ALTO LARIO","PIANTEDO","SO",46.1410586,9.4190086,802,"CENTRO RADIOLOGICO VALTELLINESE",374,TRUE,1,1
"STABILIMENTO OSPEDALIERO DI LEGNANO-PSICHIATRIA-1-CPS-1 (CPS - LEGNANO)","ATS DELLA CITTA' METROPOLITANA DI MILANO","ASST OVEST MILANESE","LEGNANO","MI",45.59992,8.93178,2528,"CPS - LEGNANO",376,TRUE,1,1
"CENTRO POLISPECIALISTICO PACINI SRL","ATS DELLA CITTA' METROPOLITANA DI MILANO","ASST FATEBENEFRATELLI SACCO","MILANO","MI",45.481361,9.2262075,728,"CENTRO POLISPECIALISTICO PACINI",377,TRUE,1,1
"CENTRO MEDICO DI MONTESCANO-RIABILITAZIONE SPECIALISTICA-1-AMBULATORIO PRINCIPALE-1 (POLIAMB. IRCCS MONTESCANO)","ATS DI PAVIA","ASST DI PAVIA","MONTESCANO","PV",45.03257,9.28457,3409,"POLIAMB. IRCCS MONTESCANO",379,TRUE,1,1
"STRUTTURA RICOVERO E CURA  DI SONDRIO-PSICHIATRIA-1-CPS-1 (CPS SONDRIO)","ATS DELLA MONTAGNA","ASST DELLA VALTELLINA E DELL'ALTO LARIO","SONDRIO","SO",46.16803,9.87251,3203,"CPS SONDRIO",380,TRUE,1,1
"CENTRO ODONTOIATRICO REGIONALE EUROPEO","ATS DI PAVIA","ASST DI PAVIA","PAVIA","PV",45.19049,9.15163,1012,"CENTRO ODONTOIATRICO REGIONALE EUROPEO",382,TRUE,1,1
"ISTITUTO SCIENTIFICO DI RIABILITAZIONE-POLIAMBULATORIO-2-AMBULATORIO PRINCIPALE-1 (ISTITUTO SCIENTIFICO  MAUGERI AMBULATORIO)","ATS DELLA CITTA' METROPOLITANA DI MILANO","ASST FATEBENEFRATELLI SACCO","MILANO","MI",45.4369599,9.2660015,2893,"ISTITUTO SCIENTIFICO  MAUGERI AMBULATORIO",384,TRUE,1,1
"PRESIDIO OSPEDALIERO ""PESENTI-FENAROLI"" - ALZANO LOMBARDO-PSICHIATRIA-1-CPS-1 (CPS - NEMBRO)","ATS DI BERGAMO","ASST DI BERGAMO EST","NEMBRO","BG",45.7476446,9.765237,3656,"CPS - NEMBRO",389,TRUE,1,1
"CENTRO MED.SPORT ASL SONDRIO","ATS DELLA MONTAGNA","ASST DELLA VALTELLINA E DELL'ALTO LARIO","SONDRIO","SO",46.16832,9.87437,36,"CENTRO MED.SPORT ASL SONDRIO",390,TRUE,1,1
"PRESIDIO OSPEDALIERO DI LODI-PSICHIATRIA-1-CPS-1 (CPS - LODI)","ATS DELLA CITTA' METROPOLITANA DI MILANO","ASST DI LODI","LODI","LO",45.31393,9.50571,2840,"CPS - LODI",391,TRUE,1,1
"ISTITUTO SCIENTIFICO DI PAVIA - SEDE DI VIA BOEZIO-RIABILITAZIONE SPECIALISTICA-1-AMBULATORIO PRINCIPALE-1 (POLIAMB.IST.SCIENT.DI PAVIA)","ATS DI PAVIA","ASST DI PAVIA","PAVIA","PV",45.18941,9.15062,3414,"POLIAMB.IST.SCIENT.DI PAVIA",393,TRUE,1,1
"""OSPEDALE PIO XI""-NEFROLOGIA-1-CAL-1 (CAL CESANO MADERNO)","ATS DELLA BRIANZA","ASST DELLA BRIANZA","CESANO MADERNO","MB",45.623228,9.1520702,3351,"CAL CESANO MADERNO",394,TRUE,1,1
"VIGEVADENT","ATS DI PAVIA","ASST DI PAVIA","VIGEVANO","PV",45.31943,8.86333,1009,"VIGEVADENT",396,TRUE,1,1
"CDI CERNUSCO","ATS DELLA CITTA' METROPOLITANA DI MILANO","ASST MELEGNANO E DELLA MARTESANA","CERNUSCO SUL NAVIGLIO","MI",45.5138767,9.3378186,712,"CDI CERNUSCO",397,TRUE,1,1
"PRESIDIO DEL VERBANO (OSP CAUSA PIA LUVINI) CITTIGLIO-PSICHIATRIA-1-CPS-1 (C.P.S. LAVENO MOMBELLO)","ATS DELL'INSUBRIA","ASST DEI SETTE LAGHI","LAVENO-MOMBELLO","VA",45.9075842,8.6228192,2910,"C.P.S. LAVENO MOMBELLO",398,TRUE,1,1
"STRUTTURA RICOVERO E CURA  DI SONDRIO-PSICHIATRIA-1-AMBULATORIO PRINCIPALE-1 (ATTIVITA' AMBULATORIALE PSICHIATRICA TIRANO)","ATS DELLA MONTAGNA","ASST DELLA VALTELLINA E DELL'ALTO LARIO","TIRANO","SO",46.2177134,10.1683316,2921,"ATTIVITA' AMBULATORIALE PSICHIATRICA TIRANO",399,TRUE,1,1
"PO DI VIZZOLO PREDABISSI - CASSANO D'ADDA (STAB DI CASSANO)-POLIAMBULATORIO-1-AMBULATORIO PRINCIPALE-1 (P.O.A.ZAPPATONI CASSANO D'ADDA)","ATS DELLA CITTA' METROPOLITANA DI MILANO","ASST MELEGNANO E DELLA MARTESANA","CASSANO D'ADDA","MI",45.522965,9.5153655,2761,"P.O.A.ZAPPATONI CASSANO D'ADDA",400,TRUE,1,1
